{
  "contract_version": "cad-projection/0.1",
  "allowed_commands": [
    "create_wall",
    "create_line",
    "create_dimension",
    "create_section_marker"
  ],
  "document": {
    "document_ref": "cad_demo_001",
    "project_ref": "project_demo_001",
    "source_revision_ref": "core_revision_mock_0001",
    "library_revision_ref": "library_revision_mock_0007",
    "title": "Wohngebäude – Demonstrationsplan",
    "plan_profile": {
      "id": "hochbau.wohngebaeude.ausfuehrung.grundriss.v1",
      "domain": "hochbau",
      "asset_kind": "wohngebaeude",
      "phase": "ausfuehrung",
      "discipline": "architektur",
      "plan_kind": "grundriss"
    }
  },
  "sheets": [
    {
      "sheet_ref": "sheet_01",
      "sheet_number": "A-001",
      "title": "Grundriss Erdgeschoss und Schnitt A-A",
      "format": "A1",
      "orientation": "landscape",
      "width_mm": 841,
      "height_mm": 594,
      "title_block": {
        "x_mm": 602,
        "y_mm": 450,
        "width_mm": 229,
        "height_mm": 134,
        "project_name": "VECTOPLAN Musterprojekt",
        "phase": "Ausführung",
        "plan_kind": "Grundriss / Schnitt",
        "scale": "1:50 / 1:100",
        "revision": "P01"
      },
      "viewports": [
        {
          "viewport_ref": "vp_ground_floor",
          "title": "Grundriss Erdgeschoss · M 1:50",
          "kind": "floor_plan",
          "sheet_rect_mm": {"x": 20, "y": 25, "width": 555, "height": 390},
          "model_view_box_mm": {"x": 0, "y": 0, "width": 14000, "height": 10000}
        },
        {
          "viewport_ref": "vp_section_a",
          "title": "Schnitt A-A · M 1:100",
          "kind": "section",
          "sheet_rect_mm": {"x": 602, "y": 25, "width": 229, "height": 250},
          "model_view_box_mm": {"x": 0, "y": 0, "width": 14000, "height": 7000}
        },
        {
          "viewport_ref": "vp_notes",
          "title": "Legende",
          "kind": "legend",
          "sheet_rect_mm": {"x": 602, "y": 300, "width": 229, "height": 120},
          "notes": [
            "Testinput ohne Core-Verbindung",
            "Wände sind semantische Mock-Elemente",
            "Teilansichten sind Viewports auf einem Blatt",
            "Werkzeuge erzeugen validierte lokale CadCommand-Entwürfe"
          ]
        }
      ],
      "elements": [
        {
          "element_ref": "wall_ext_north",
          "label": "Außenwand Nord",
          "kind": "wall",
          "layer": "walls",
          "source": "mock_core_projection",
          "family_ref": "hochbau.waende.ziegelwand",
          "variant_ref": "36_5cm_aussenwand",
          "view_refs": ["vp_ground_floor"],
          "geometry": {"start_mm": [1200, 1200], "end_mm": [12400, 1200], "thickness_mm": 365}
        },
        {
          "element_ref": "wall_ext_east",
          "label": "Außenwand Ost",
          "kind": "wall",
          "layer": "walls",
          "source": "mock_core_projection",
          "family_ref": "hochbau.waende.ziegelwand",
          "variant_ref": "36_5cm_aussenwand",
          "view_refs": ["vp_ground_floor"],
          "geometry": {"start_mm": [12400, 1200], "end_mm": [12400, 8200], "thickness_mm": 365}
        },
        {
          "element_ref": "wall_ext_south",
          "label": "Außenwand Süd",
          "kind": "wall",
          "layer": "walls",
          "source": "mock_core_projection",
          "family_ref": "hochbau.waende.ziegelwand",
          "variant_ref": "36_5cm_aussenwand",
          "view_refs": ["vp_ground_floor"],
          "geometry": {"start_mm": [12400, 8200], "end_mm": [1200, 8200], "thickness_mm": 365}
        },
        {
          "element_ref": "wall_ext_west",
          "label": "Außenwand West",
          "kind": "wall",
          "layer": "walls",
          "source": "mock_core_projection",
          "family_ref": "hochbau.waende.ziegelwand",
          "variant_ref": "36_5cm_aussenwand",
          "view_refs": ["vp_ground_floor"],
          "geometry": {"start_mm": [1200, 8200], "end_mm": [1200, 1200], "thickness_mm": 365}
        },
        {
          "element_ref": "wall_inner_01",
          "label": "Tragende Innenwand",
          "kind": "wall",
          "layer": "walls",
          "source": "mock_core_projection",
          "family_ref": "hochbau.waende.ziegelwand",
          "variant_ref": "24cm_tragend",
          "view_refs": ["vp_ground_floor"],
          "geometry": {"start_mm": [6600, 1200], "end_mm": [6600, 8200], "thickness_mm": 240}
        },
        {
          "element_ref": "wall_inner_02",
          "label": "Nichttragende Innenwand",
          "kind": "wall",
          "layer": "walls",
          "source": "mock_core_projection",
          "family_ref": "hochbau.waende.ziegelwand",
          "variant_ref": "11_5cm_nicht_tragend",
          "view_refs": ["vp_ground_floor"],
          "geometry": {"start_mm": [6600, 5000], "end_mm": [12400, 5000], "thickness_mm": 115}
        },
        {
          "element_ref": "door_entrance",
          "label": "Eingangstür",
          "kind": "opening",
          "layer": "openings",
          "source": "mock_core_projection",
          "family_ref": "hochbau.oeffnungen.tuer",
          "variant_ref": "haustuer_1010",
          "view_refs": ["vp_ground_floor"],
          "geometry": {"x_mm": 5250, "y_mm": 1020, "width_mm": 1400, "height_mm": 380}
        },
        {
          "element_ref": "window_south_01",
          "label": "Fenster Süd",
          "kind": "opening",
          "layer": "openings",
          "source": "mock_core_projection",
          "family_ref": "hochbau.oeffnungen.fenster",
          "variant_ref": "fenster_2010",
          "view_refs": ["vp_ground_floor"],
          "geometry": {"x_mm": 8200, "y_mm": 8020, "width_mm": 2200, "height_mm": 380}
        },
        {
          "element_ref": "room_label_living",
          "label": "Wohnen",
          "kind": "room_label",
          "layer": "annotations",
          "source": "mock_core_projection",
          "view_refs": ["vp_ground_floor"],
          "text": "Wohnen\n31,4 m²",
          "geometry": {"x_mm": 9300, "y_mm": 3500}
        },
        {
          "element_ref": "room_label_service",
          "label": "Technik",
          "kind": "room_label",
          "layer": "annotations",
          "source": "mock_core_projection",
          "view_refs": ["vp_ground_floor"],
          "text": "Technik\n12,8 m²",
          "geometry": {"x_mm": 9300, "y_mm": 6600}
        },
        {
          "element_ref": "section_ground",
          "label": "Geländelinie",
          "kind": "line",
          "layer": "annotations",
          "source": "mock_core_projection",
          "view_refs": ["vp_section_a"],
          "geometry": {"start_mm": [800, 5800], "end_mm": [13200, 5800]}
        },
        {
          "element_ref": "section_slab_01",
          "label": "Bodenplatte",
          "kind": "structure",
          "layer": "structure",
          "source": "mock_core_projection",
          "family_ref": "hochbau.decken.bodenplatte",
          "variant_ref": "stahlbeton_250mm",
          "view_refs": ["vp_section_a"],
          "geometry": {"x_mm": 1200, "y_mm": 5200, "width_mm": 11200, "height_mm": 300}
        },
        {
          "element_ref": "section_wall_left",
          "label": "Schnittwand links",
          "kind": "structure",
          "layer": "structure",
          "source": "mock_core_projection",
          "family_ref": "hochbau.waende.ziegelwand",
          "variant_ref": "36_5cm_aussenwand",
          "view_refs": ["vp_section_a"],
          "geometry": {"x_mm": 1200, "y_mm": 1600, "width_mm": 365, "height_mm": 3600}
        },
        {
          "element_ref": "section_wall_right",
          "label": "Schnittwand rechts",
          "kind": "structure",
          "layer": "structure",
          "source": "mock_core_projection",
          "family_ref": "hochbau.waende.ziegelwand",
          "variant_ref": "36_5cm_aussenwand",
          "view_refs": ["vp_section_a"],
          "geometry": {"x_mm": 12035, "y_mm": 1600, "width_mm": 365, "height_mm": 3600}
        },
        {
          "element_ref": "section_roof",
          "label": "Dachlinie",
          "kind": "line",
          "layer": "structure",
          "source": "mock_core_projection",
          "view_refs": ["vp_section_a"],
          "geometry": {"start_mm": [1200, 1600], "end_mm": [6800, 500]}
        },
        {
          "element_ref": "section_roof_02",
          "label": "Dachlinie",
          "kind": "line",
          "layer": "structure",
          "source": "mock_core_projection",
          "view_refs": ["vp_section_a"],
          "geometry": {"start_mm": [6800, 500], "end_mm": [12400, 1600]}
        }
      ]
    }
  ]
}
